{"architecture":"amd64","completedAt":"2026-09-01T12:00:01.000Z","hostOnly":true,"identity":{"bootId":"boot-1","sandboxId":"sandbox-1","templateDigest":"sha256:aaaaaaaaaaaaaaaaaaaaaaaaaaaaaaaaaaaaaaaaaaaaaaaaaaaaaaaaaaaaaaaa","vmId":"vm-1"},"kind":"squire-sandbox-host-observer-result","observations":{"allowedHttpsObserved":true,"attributionVerified":true,"authentication":"trusted-host","deniedProbeObserved":true,"verified":true},"parentRequestId":"44444444-4444-4444-8444-444444444444","phase":"running","platform":"linux","probe":"network-audit","releaseId":"release-v039","requestId":"33333333-3333-4333-8333-333333333333","runId":"run_hostconformance01","sandboxName":"squire-v1-j4gbqa6djpmmsnwvlvqz5jw34e","schemaVersion":1,"status":"pass"}
